<!DOCTYPE database SYSTEM "sql-structure.dtd">

<database>
  <name>foo</name>
  <description>A database for storing random stuff</description>
  <version>1.0</version>

  <table>
    <name>bar</name>
    <description>A table for storing random stuff</description>
  
    <field>
      <description>unique identifier for each bar</description>
      <type>int</type>
      <option>not null</option>
      <option>auto_increment</option>
    </field>

    <field>
      <description>name for each bar</description>
      <type>varchar</type>
      <length>255</length>
      <option>not null</option>
    </field>

    <index>
      <type>primary key</type>
      <column>bar_id</column>
    </index>
  </table>

</database>
